KVCS:235;Rynders (Rijnders, Reinders), Hendrik;m;;;Amsterdam;tweede Tuyn dwars straat;1704 - c.1761;boekhandelaar en boekdrukker ;93a
KVCS:236;Rynders (Rijnders, Reinders), Wed Hendrik;v;O236;;Amsterdam;tweede Tuyn dwars straat;c.1761 - 1781;boekdrukker en -verkoper;93 b
KVCS:176;Sande en Co, W G  van der;m, m;na beëindiging 7, Copvolger van = Abraham de Haan te Beau Vallon (St. Gervais);?-1811;Amsterdam en Namen (St. Servais);Warmoesstraat 33a;1806 - 1811;prentdrukker en -verkoper;95
KVCS:177;Schaaf, J J ;m;mogelijk opvolger van 9  ;;Kevelaar;;1893 - na 1900;prentdrukker en -verkoper;96
KVCS:178;Schaffrath, N  en G  N ;m, m;;;Gelder;;1780 - 1820;boek- en prentdrukker en -verkoper;97
KVCS:179;Scheffers, Johannes;m;;?-1824;Rotterdam;op de Stinksloot (1786-1788), by de Princestraat, Penningsbrug (1806-1811) ;1781 - 1825;boekhandelaar, boek- prent- en lieddrukker;98
KVCS:181;Schierbeek jr, Rudolf Jacob;m, m;opvolger van 180;1813-1889;Groningen;;1835 - 1882;boekhandelaar, boek- en prentuitgever;99
KVCS:180;Schierbeek sr, Roelof Jacob;m, m;;1778-1844;Groningen;;1798 - 1835;boekhandelaar en -uitgever;100
KVCS:182;Schillemans & Van Belkum;m, m;opvolger van 222 voor prenten en kindertijdaschriften;Cornelis Schillemans (1840-1903), Piet van Belkum (1853-1941);Zutphen;;1892 - 1915;boek- en prent- en tijdschriftuitgevers;101
KVCS:183;Schuitemaker, Jan;m;opvolger van 31 ;1821-1892;Purmerend;;1842 - 1857;boek- en prent- en krantdrukker en verkoper;102
KVCS:184;Segboer, Arie Willem ;m;opvolger van 84 voor de prentreeks;;'s Gravenhage;Oranjeplein 67;1901 - c.1940;boek- en prentuitgever, kioskexploitant;103
KVCS:186;Seydel,  Weduwe  Johannes;v;opvolger van185;;Leeuwarden;;1813 - ?;boek- en prentdrukker en verkoper;104a
KVCS:185;Seydel, Johannes;m;;1771-1813;Leeuwarden;Koningstraat, later: Vischmarkt;1775 - 1813;boek- en prentdrukker en verkoper;104
KVCS:194;Sijthoff (Sythoff), Albertus Willem ;m;;829-1913;Leiden;;1853 - 1891;boek- en prentdrukker, uitgever en verkoper;111
KVCS:187;Sluis, Dirk van der;m;;;Franeker (1774-1795), Leeuwarden (1795-1816);nevens de Vismarkt;1774 - 1816;boek- en prentdrukker en verkoper;105
KVCS:188;Smallenburg, F W  van Breest;m;;;Sneek;;1810 - 1833;boek- en prentdrukker en verkoper;106
KVCS:241;Spierincx I, Antoon;m;;1565-1625;Antwerpen;;1584 - 1625;boek- prent- en speelkaartdrukker, houtsnijder;107a
KVCS:189;Spierincx II, Antoon;m;opvolger van 241;1592-16??;Antwerpen;Lombaerde Vest;1612 - 1666;boek- prent- en speelkaartdrukker, houtsnijder;107b
KVCS:190;Staden, C C L  van ;m;;;Amsterdam;Warmoesstraat, schuin over de Oude Kerksteeg, in de Oude Berg Calvarie, No. 159, later: op de Waal bij de Oude Schans;1812 - c.1850;boek- en prentdrukker en verkoper;108
KVCS:191;Staden, P C L  van ;m;opvolger van 192;;Amsterdam;Heerengracht hoek Hartenstraat’, later ‘N.Z. Achterburgwal bij de Molsteeg g 63;c.1850 - c.1870;boek- en prentdrukker en verkoper;108a
KVCS:232;Steenwerckx, Maria Teresia;v;;?-1851;Antwerpen;Kleinmarkt, later: Kammenstraat;1830-1851 - ;prentdrukker, boek- en prentverkoper;
KVCS:242;Stichter, Cornelis I Jansz.;m;;?-1656;Amsterdam;;1648 - 1656;boek- prent- en smoutdrukker;
KVCS:244;Stichter, Cornelis II.;m;opvolger van 243;;Amsterdam;;1704 - 1705;boek- en prentdrukker en verkoper;
KVCS:192;Stichter, Erve de  Weduwe  C ;;opvolger van 245, meerdere opvolgers bleven onder deze naam uitgeven;;Amsterdam;No. 159;1788 - c.1813;boek- en prentdrukkers en verkopers;109
KVCS:243;Stichter, Johannes;m;opvolger van 242;;Amsterdam;;1656 - 1704?;boek- en prentdrukker en verkoper;
KVCS:245;Stichter, Wed Cornelis II (=Agnes ter Hell);v;opvolger van 244;;Amsterdam;;1705 - 1714;boek- en prentdrukker en verkoper;
KVCS:193;Suringar, Gerard Tjaard Nicolaas ;m;;1804-1884;Leeuwarden;;1821 - 1874;boek- en prentdrukker en verkoper;110
KVCS:196;Tellier,  Weduwe  J H  en Dominicus Laurentius  Verhoeven;v, m;opvolger van195;Weduwe  = Anna Maria van Gansen 1748-1814;Lier;;1809 - 1816;boek- en prentdrukker en verkoper;112a
KVCS:195;Tellier, Jacobus Henricus le;m;;1748-1809;Lier;;1770 - 1809;boekbinder, boek- en prentdrukker en verkoper;112
KVCS:198;Termeulen, J jr.;m;;;Amsterdam;in de Bloemstraat, tusschen de Eerste en tweede Dwarsstraat, ook: Tabaksplaatdrukker op de Roosegracht, bij de eerste Dwarsstraat;1789 - 1804;prent- en tabaksplaatdrukker;113
KVCS:199;Thompsom, Jacobus;m;;;Rotterdam;op de Hoogstraat by de Nauwemarktsteeg, ook op de Hoogstraat Wijk G nopvolger van 104;1786 - 1810;boek- en prentdrukker en verkoper;114
KVCS:201;Thompson, Gebr ;m, m;opvolger van200, samenwerking van 202 en 203 ;;Rotterdam;;1825 - 1830;boek- en prentdrukkers en verkopers;114b
KVCS:200;Thompson, Jacobus Johannes ;m;opvolger van199;;Rotterdam;;1810 - 1825;boek- en prentdrukker en verkoper;114a
KVCS:202;Thompson, Theodorus Leonardus)T L ;m;opvolger van201;;Rotterdam;;1830 - 1833;Boek-, Plaat en Steendrukkerij, Binderij en Linieerfabriek;114c
KVCS:203;Thompson, Willem;m;opvolger van202;;Rotterdam;;1830 - 1837;boek- en prentdrukker en verkoper;114d
KVCS:204;Ulrich, Jan Bernardus;m;opvolger van 93;1796-1849;Rotterdam;Schiedamse dijk C137 of Schotschendijk C137;1819 - 1849;boek- en prentdrukker en verkoper;115
KVCS:205;Verbeeck;m;;;Kevelaar;;c.1850 - na 1885;drukkers van religieuze grafiek;116
KVCS:197;Verhoeven, Franciscus Gaspar Adrianus;m;opvolger van196, verkocht de prentenfabriek aan 20;1773-1837;Lier;;1816 - 1819;boek- en prentdrukker en verkoper;112b
KVCS:207;Vinck,  Weduwe Joannes Norbertus ;v;opvolger van 206;Joanna Maria Regina Lemmers 1768-1831;Antwerpen;;1813 - 1820;boek- en prentdrukker en verkoper;11b
KVCS:208;Vinck, Ab;m;opvolger van 207?;;Antwerpen;;na 1850 - ?;boek- en prentdrukker en verkoper;117c
KVCS:206;Vinck, Joannes Norbertus  ;m;;c.1854-1813;Antwerpen;aan het Klapdorp;1789 - 1813;boek- en prentdrukker en verkoper;117a
KVCS:209;Vlieger, J ;m;opvolger van 247;1844-1908;Amsterdam;Haringpakkerij L 271 of Halvemaansteeg Y 520;1869 - 1908;papier-, boek- en prenthandel;183c
KVCS:210;Vos, Jan de & Comp;m, m;;;Dordrecht;;1808 - 1849;boek- en prentdrukker en verkoper;119
KVCS:248;Wal, Johannes  van der;m;;;Gorinchem;Langendijk 22;1797 - 1834;boek- en prenthandelaar, uitgever;120b
KVCS:211;Wal, W  van der;m;opvolger van 248;?-1837;Gorinchem;Langendijk 22, op den hoek van de Hoogstraat;1834 - 1837;boek- en prenthandelaar, uitgever;120b
KVCS:249;Walpot, Adriaan ;m;opvolger van 212;;Dordrecht; in de Voorstraat, over ’t Stadhuis, in de Groote Bybel;1761 - 1781;boek- en prentdrukker en verkoper;121c
KVCS:250;Walpot, Adriaan en Hendrik II;m;opvolger van 249;;Bdordrecht;;1781 - 1791;boek- en prentdrukker en verkoper;
KVCS:212;Walpot, Hendrik II;m;;;Dordrecht;bij de Beurs, later: in de Voorstraat, over ’t Stadhuis, in de Gekroonde Bybel;1727 - 1761;boek- en prentdrukker en verkoper;121a
KVCS:251;Walpot, Hendrik II;m;opvolger van 250;;Dordrecht; in de Voorstraat, over ’t Stadhuis, in de Groote Bybel;1791 - c.1809;boek- en prentdrukker en verkoper;121c
KVCS:251;Walpot, Hendrik III;m;opvolger van 251;;Dordrecht; in de Voorstraat, over ’t Stadhuis, in de Groote Bybel;c.1809 - na 1812;boek- en prentdrukker en verkoper;121d
KVCS:252;Wansleven, Carel Anton en Herman Gerhard;m, m;opvolger van 213;;Zurphen;;1857 - ?;boek- en prentdrukker en verkoper;122b
KVCS:213;Wansleven, Willem Carel;m;;1779-1860;Zutphen;Sprongstraat, later Beukerstraat;1806 - 1857;boekhandelaar, uitgever, boek- en prentdrukker, houder leesbibliotheek, veilinghouder;122a
KVCS:214;Weege (Wege), David;m;;;Amsterdam;op de Nieuwendyk;1748 - 1787;boek- en prentdrukker en verkoper;123
KVCS:216;Wellens, Delhuvenne en Comp;;samenwerking van 48, 215 en  de zonen van 215, firma werd gesplitst in 1842 tussen 48 en 215;;Turnhout;;1734 - 1842;papierverkopen, drukker-uitgever ;125
KVCS:215;Wellens, Petrus Frans;m;opvolger van 216;;Turnhout;;1842 - 1849;houtsnijder, fabrikant sierpapier, drukker en uitgever van speelkaarten, prenten en boeken;124
KVCS:217;Wendel & zoon;m, m;opvolger van 253;;Amsterdam;Angeliers-gragt by de 2de Dwarsstraat (Nopvolger van 148);1819 - 1843;lied-  en prentdrukker en verkoper;126b
KVCS:218;Wendel,  Weduwe  J H ;v;opvolger van 217;;Amsterdam;Angeliers-gragt by de 2de Dwarsstraat (Nopvolger van 148);1843 - 1846;lied-  en prentdrukker en verkoper;126c
KVCS:253;Wendel, Jacob  ;m;;;Amsterdam;tweede Angeliers Dwarsstraat by de Angeliersgragt;1795- - 1819;lied-, prent en tabaksplaatdrukker en verkoper;126a
KVCS:219;Wigeri, Wigerus;m;;1747-1794;Leeuwarden;op de Kelders, vanaf 1752 in de Peperstraat ‘in de Rotterdamse Erasmus';1752 - 1783;boek- en prentdrukker en verkoper;127
KVCS:220;Wijnhoven-Hendriksen, Theodorus Johannes ;m;vanaf 1828 ook opvolger van 93;1791-1850;Rotterdam;Hoogstraat h 28;1819 - 1849;boek- en prentdrukker, steendrukker ;128
KVCS:256;Wijsmuller (Wysmuller, Weismulder, Weismuller), Johannes Jacobus;m;;1807-1882);Amsterdam;op het Spuij ;1777 - ;handelaar in papierwaren, boekbindersartikelen en kantoorbehoeften;129a
KVCS:221;Wijsmuller, Erve;m;opvolger van 257;;Amsterdam;;1828 - 1903;handelaar in papierwaren, prenten en kantoorbehoeften;129c
KVCS:257;Wijsmuller, Johannes Paulus;m;opvolger van 256;1776-1850;Amsterdam;in de Huidenstraat;1803 - 1826?;handelaar in papierwaren, boekbindersartikelen en kantoorbehoeften;129b
KVCS:222;Ykema, Joh ;m;;;'s Gravenhage;;1876 - 1893;boek- en prent- en tijdschriftuitgever;130
KVCS:223;Zalsman, G  Ph ;m;;;Kampen;;1857 - na 1900;boek- en prentdrukker en verkoper;131